,file_path,transcription,topic,topic_probability,nouns,probabilities
27,./././Data/test_data/mid_presentation/ano\20240703\split_audio_3_1.wav,あのちゃんのモノマネしてたよっていうね情報で情報でそうでも初っ端から50m走いつまで50m走かやってたんですけど計6レーサーの出演者分6レーサーあってでその1位その6レーサーの中の1位の人をとあと2位の人から1人で最後のあの決勝が僕は4レース目に走るってことでニコルちゃんと2年前のニコルちゃんとあと150mで一緒だったからニコルちゃんもいてあと福田真希さんもいたりとかあと僕の隣にドシンドシンって熊本プロレスさん紅生姜の聖夜の花食べの熊本プロレスさん本当に面白かったな紅生姜さんその日以来めっちゃドハマリしてる僕紅生姜さんでまあその4人で4レース目は結構ぶっちぎりで1位でした良かったんですけどで決勝決勝が5、6人いたのかな優勝候補のみちょぱさんとかまああとフワちゃんが前回1位になってるのかなそこら辺も優勝候補がいる中やりましてでこれが惜しくも2位ですね同じ7秒台だけどまあ僅差でフワちゃんが1位で僕破れるみたいな感じでもまあ個人的には2年前3位だったの,98,0.1612082868814468,"['スタジオ', '運命', '神様', 'プロレス']","[0.7913753, 0.06959579, 0.05605588, 0.05277253]"
28,./././Data/test_data/mid_presentation/ano\20240703\split_audio_3_1.wav,決勝だからめっちゃ嬉しかった2位がしかもスタートが感覚的に遅れた気がなりながら最後スピード上げて2位までさっきみちょぱが目先にいたぐらいから2位まで行けたからリンボーリンボーっていう棒下思った通りダメでした背筋系結構きついんだよなリンボーをやる場所そこに今MC人りよしさんとあつしさんとふじもんさんがいてカメラマンがカメラめっちゃ多いのよあのロンハーってカメラバーってやってスタッフさんもブワーってタレント側待機側はてか特にリンボーは全然見えなかったの死語タレント側の死語が多すぎるっていう,34,0.1355092674493789,"['場所', 'カメラ']","[0.7908804, 0.18536389]"
29,./././Data/test_data/mid_presentation/ano\20240703\split_audio_3_1.wav,めっちゃ死語多くて誰もリンボー見てない時間あったのぺちゃぺちゃあっちこっちも聞こえないからなんとかかとかってなんとかどなーとかりよしさんにも言われてそうだから誰もリンボー見ないで洋キャラっていうか結構テンション高めのメンツだからさ基本的に死語別にする人もいないというかそのタイミングもただなんかのぶこさんパーティーちゃんののぶこさんとゆうちゃみさんとふわちゃんがもうずっとわけわけピアス開けたくねーみたいなギャルすぎるピアス開けたくねーとか言ってなんか僕の耳とかも,36,0.336433082818985,"['ギャル', '高め', 'リボン', 'ピアス']","[0.66423434, 0.18605903, 0.05405339, 0.03840672]"
